{
  "$schema": "http://json-schema.org/draft-07/schema#",
  "$id": "https://familyoffice.local/schemas/cashflow.schema.json",
  "title": "CashflowRecord",
  "description": "Container for all cashflow data: sources, line items, debt service, liquidity buckets, and runway snapshots. Stored at cashflow/cashflow.json and updated monthly.",
  "type": "object",
  "required": ["sources", "items", "debt_service", "liquidity_buckets", "runway_snapshots"],
  "additionalProperties": false,

  "definitions": {

    "CashFlowSource": {
      "title": "CashFlowSource",
      "description": "A recurring or one-time source (or sink) of cash. Used as a foreign key from CashFlowItem.",
      "type": "object",
      "required": ["id", "name", "type", "active"],
      "additionalProperties": false,
      "properties": {
        "id": {
          "type": "string",
          "format": "uuid",
          "description": "UUID v4.",
          "examples": ["csrc_a1b2c3d4-e5f6-7890-abcd-ef1234567890"]
        },
        "name": {
          "type": "string",
          "description": "Human-readable label for this source.",
          "examples": ["Downtown Loft — Rental Income", "VTSAX Dividends", "First National Mortgage — Loft Portfolio"]
        },
        "type": {
          "type": "string",
          "enum": ["rental", "dividend", "operating", "interest", "distribution", "debt-service", "capex", "operating-expense", "tax-payment", "other"],
          "description": "Category of this cash source/sink. Income types (rental, dividend, etc.) produce positive CashFlowItems. Expense types (debt-service, capex, operating-expense) produce negative items."
        },
        "deal_ref": {
          "type": ["string", "null"],
          "description": "Relative path to the deal.json this source is linked to. Null for family-office-level sources (e.g., operating expenses).",
          "examples": ["deals/downtown-loft-portfolio/deal.json", null]
        },
        "active": {
          "type": "boolean",
          "description": "Whether this source is currently generating cashflow. Set to false when a deal is exited or a loan is paid off."
        },
        "expected_monthly_usd": {
          "type": ["number", "null"],
          "description": "Expected monthly amount in USD. Positive for inflows, negative for outflows. Used for runway projections.",
          "examples": [12500, -12800, null]
        },
        "notes": {
          "type": ["string", "null"],
          "description": "Any context about this source.",
          "examples": ["3-unit building, leases expire June 2027", "Quarterly dividend, paid in Jan/Apr/Jul/Oct", null]
        }
      }
    },

    "CashFlowItem": {
      "title": "CashFlowItem",
      "description": "A single cash event for a specific period. Immutable once created.",
      "type": "object",
      "required": ["id", "source_id", "period", "amount_usd", "category", "provenance"],
      "additionalProperties": false,
      "properties": {
        "id": {
          "type": "string",
          "format": "uuid",
          "description": "UUID v4.",
          "examples": ["cfi_b2c3d4e5-f6a7-8901-bcde-f12345678901"]
        },
        "source_id": {
          "type": "string",
          "format": "uuid",
          "description": "FK to CashFlowSource.id.",
          "examples": ["csrc_a1b2c3d4-e5f6-7890-abcd-ef1234567890"]
        },
        "period": {
          "type": "string",
          "pattern": "^\\d{4}-(0[1-9]|1[0-2])$",
          "description": "Accounting period in YYYY-MM format.",
          "examples": ["2026-06", "2026-07"]
        },
        "amount_usd": {
          "type": "number",
          "description": "Cash amount in USD. Positive = inflow (money received). Negative = outflow (money paid out).",
          "examples": [12500, -12800, 3251, -8500]
        },
        "category": {
          "type": "string",
          "enum": ["rental-income", "dividend", "distribution", "interest-income", "operating-revenue", "debt-service", "capex", "operating-expense", "tax-payment", "other"],
          "description": "Accounting category for this item."
        },
        "accrual_date": {
          "type": ["string", "null"],
          "format": "date",
          "description": "Date the cash was actually received or paid. May differ from period if cross-month.",
          "examples": ["2026-06-15", null]
        },
        "notes": {
          "type": ["string", "null"],
          "description": "Variance notes or context.",
          "examples": ["Unit 2 vacancy July — prorated to $3,200", "Q2 2026 dividend: 1500 shares @ $2.50/sh, CA state withholding applied", null]
        },
        "provenance": {
          "type": "object",
          "required": ["source", "timestamp_utc", "author"],
          "additionalProperties": false,
          "properties": {
            "source": {
              "type": "string",
              "description": "How this item was recorded.",
              "examples": ["bank statement upload 2026-07-03", "automated from deal-update e6a3d9f7", "manual entry by grayson.culliford@hivefs.com"]
            },
            "timestamp_utc": {
              "type": "string",
              "format": "date-time",
              "examples": ["2026-07-03T09:00:00Z"]
            },
            "author": {
              "type": "string",
              "examples": ["grayson.culliford@hivefs.com", "cashflow_snapshot.py v1.1.0"]
            },
            "file_hash": {
              "type": ["string", "null"],
              "description": "Hash of the source document (bank statement, distribution notice) if applicable.",
              "examples": ["a3f9b1c2", null]
            }
          }
        }
      }
    },

    "DebtService": {
      "title": "DebtService",
      "description": "A single loan, mortgage, line of credit, or other debt obligation.",
      "type": "object",
      "required": ["id", "deal_ref", "lender", "loan_type", "balance_usd", "rate", "rate_type", "payment_usd", "maturity_date"],
      "additionalProperties": false,
      "properties": {
        "id": {
          "type": "string",
          "format": "uuid",
          "examples": ["debt_c3d4e5f6-a7b8-9012-cdef-123456789012"]
        },
        "deal_ref": {
          "type": "string",
          "description": "Relative path to the associated deal.json.",
          "examples": ["deals/downtown-loft-portfolio/deal.json"]
        },
        "lender": {
          "type": "string",
          "examples": ["First National Bank", "Wells Fargo", "SBA 7(a) Program"]
        },
        "loan_type": {
          "type": "string",
          "enum": ["mortgage", "LOC", "term-loan", "bridge", "mezzanine", "sba", "other"],
          "description": "Type of debt instrument."
        },
        "balance_usd": {
          "type": "number",
          "minimum": 0,
          "description": "Outstanding principal balance in USD.",
          "examples": [1850000, 450000]
        },
        "rate": {
          "type": "number",
          "minimum": 0,
          "maximum": 1,
          "description": "Annual interest rate as a decimal. Example: 0.0625 = 6.25%.",
          "examples": [0.0625, 0.075]
        },
        "rate_type": {
          "type": "string",
          "enum": ["fixed", "variable", "floating"],
          "description": "Whether the rate changes over time."
        },
        "index_rate": {
          "type": ["string", "null"],
          "description": "If rate_type = variable or floating, the benchmark index.",
          "examples": ["SOFR + 2.5%", "Prime + 1.0%", null]
        },
        "payment_usd": {
          "type": "number",
          "minimum": 0,
          "description": "Monthly principal + interest payment in USD.",
          "examples": [12800, 3750]
        },
        "maturity_date": {
          "type": "string",
          "format": "date",
          "description": "Date the loan matures / comes due.",
          "examples": ["2032-07-01", "2028-03-15"]
        },
        "origination_date": {
          "type": ["string", "null"],
          "format": "date",
          "examples": ["2022-07-01", null]
        },
        "dscr": {
          "type": ["number", "null"],
          "minimum": 0,
          "description": "Debt Service Coverage Ratio = NOI / Annual Debt Service. Calculated and updated by cashflow_snapshot.py. Alert if < 1.25.",
          "examples": [1.07, 1.50, null]
        },
        "ltv_pct": {
          "type": ["number", "null"],
          "minimum": 0,
          "maximum": 100,
          "description": "Loan-to-value percentage based on most recent appraisal.",
          "examples": [64.9, 72.0, null]
        },
        "notes": {
          "type": ["string", "null"],
          "examples": ["Interest-only first 2 years, then P&I. Balloon payment at maturity.", null]
        }
      }
    },

    "LiquidityBucket": {
      "title": "LiquidityBucket",
      "description": "A named pool of liquid cash. The three buckets represent the barbell Layer 1 structure.",
      "type": "object",
      "required": ["name", "balance_usd", "as_of_date", "institution"],
      "additionalProperties": false,
      "properties": {
        "name": {
          "type": "string",
          "enum": ["operating", "reserve", "deployment"],
          "description": "operating = day-to-day expenses; reserve = 3–6 month emergency buffer; deployment = earmarked for next investment."
        },
        "balance_usd": {
          "type": "number",
          "minimum": 0,
          "description": "Current balance in USD.",
          "examples": [285000, 150000, 52000]
        },
        "as_of_date": {
          "type": "string",
          "format": "date",
          "description": "Date this balance was last confirmed.",
          "examples": ["2026-06-23"]
        },
        "institution": {
          "type": "string",
          "description": "Where this cash is held.",
          "examples": ["Chase Business Checking", "Marcus HYSA", "Fidelity Money Market FZFXX"]
        },
        "apy_pct": {
          "type": ["number", "null"],
          "description": "Annual percentage yield on this account. Tracked to optimize idle cash.",
          "examples": [4.85, 0.01, null]
        },
        "notes": {
          "type": ["string", "null"],
          "examples": ["Main operating account — covers payroll, vendors, professional services", null]
        }
      }
    },

    "RunwaySnapshot": {
      "title": "RunwaySnapshot",
      "description": "Point-in-time snapshot of total liquidity vs. burn rate. Written monthly by cashflow_snapshot.py.",
      "type": "object",
      "required": ["id", "as_of_date", "monthly_burn_usd", "total_liquid_usd", "runway_months", "alert_triggered"],
      "additionalProperties": false,
      "properties": {
        "id": {
          "type": "string",
          "format": "uuid",
          "examples": ["snap_d4e5f6a7-b8c9-0123-def0-123456789012"]
        },
        "as_of_date": {
          "type": "string",
          "format": "date",
          "description": "Date of this snapshot.",
          "examples": ["2026-06-23"]
        },
        "monthly_burn_usd": {
          "type": "number",
          "minimum": 0,
          "description": "Average monthly net cash outflow, calculated as 6-month rolling average of negative net cashflow months.",
          "examples": [42000, 38500]
        },
        "total_liquid_usd": {
          "type": "number",
          "minimum": 0,
          "description": "Sum of all LiquidityBucket balances.",
          "examples": [487000, 612000]
        },
        "runway_months": {
          "type": "number",
          "minimum": 0,
          "description": "total_liquid_usd / monthly_burn_usd. The most important single number in this module.",
          "examples": [11.6, 15.9]
        },
        "bucket_breakdown": {
          "type": "object",
          "description": "Snapshot of each bucket balance at this point in time.",
          "properties": {
            "operating_usd": { "type": "number", "examples": [285000] },
            "reserve_usd": { "type": "number", "examples": [150000] },
            "deployment_usd": { "type": "number", "examples": [52000] }
          }
        },
        "monthly_inflows_usd": {
          "type": ["number", "null"],
          "description": "Total cash inflows for the period ending as_of_date.",
          "examples": [31584, null]
        },
        "monthly_outflows_usd": {
          "type": ["number", "null"],
          "description": "Total cash outflows for the period ending as_of_date (positive number).",
          "examples": [33050, null]
        },
        "net_monthly_cashflow_usd": {
          "type": ["number", "null"],
          "description": "monthly_inflows_usd minus monthly_outflows_usd. Negative = net burn.",
          "examples": [-1466, 4250, null]
        },
        "alert_triggered": {
          "type": "boolean",
          "description": "True if any alert rule fired during this snapshot calculation."
        },
        "alert_type": {
          "type": ["string", "null"],
          "enum": ["cash-crunch", "cash-crunch-warning", "forced-sale-risk", "refi-cliff", "low-dscr-watch", null],
          "description": "Which alert rule fired. Null if alert_triggered = false."
        },
        "alert_detail": {
          "type": ["string", "null"],
          "description": "Human-readable explanation of the alert.",
          "examples": ["Downtown Loft DSCR = 1.07, below 1.25 threshold", "Runway 2.8 months — below 3-month minimum", null]
        },
        "notes": {
          "type": ["string", "null"],
          "description": "Human commentary on this snapshot.",
          "examples": ["Deployment bucket will be used for Meridian commitment in July — adjust runway projection", null]
        }
      }
    }

  },

  "properties": {
    "sources": {
      "type": "array",
      "description": "All active and historical CashFlowSource records.",
      "items": { "$ref": "#/definitions/CashFlowSource" }
    },
    "items": {
      "type": "array",
      "description": "All CashFlowItem records. Immutable — new periods add new items; old items are never edited.",
      "items": { "$ref": "#/definitions/CashFlowItem" }
    },
    "debt_service": {
      "type": "array",
      "description": "All active and historical debt instruments.",
      "items": { "$ref": "#/definitions/DebtService" }
    },
    "liquidity_buckets": {
      "type": "array",
      "description": "Current state of each liquidity bucket. Updated monthly.",
      "items": { "$ref": "#/definitions/LiquidityBucket" }
    },
    "runway_snapshots": {
      "type": "array",
      "description": "Historical runway snapshots. Each month appends a new record. Also written individually to cashflow/runway_snapshots/runway_{YYYY-MM-DD}.json.",
      "items": { "$ref": "#/definitions/RunwaySnapshot" }
    }
  }
}
